{
  "$schema": "https://json-schema.org/draft/2020-12/schema",
  "$id": "https://xcompute-probe.local/schemas/xcp-creative-project-v1.schema.json",
  "title": "XCP editable creative project v1",
  "type": "object",
  "additionalProperties": false,
  "required": [
    "schema_version",
    "project_id",
    "version",
    "title",
    "description",
    "entry_module",
    "modules",
    "assets",
    "requested_capabilities"
  ],
  "properties": {
    "schema_version": {
      "const": "xcp-creative-project-v1"
    },
    "project_id": {
      "$ref": "#/$defs/identifier"
    },
    "version": {
      "$ref": "#/$defs/semantic_version"
    },
    "title": {
      "type": "string",
      "minLength": 1,
      "maxLength": 96
    },
    "description": {
      "type": "string",
      "minLength": 1,
      "maxLength": 1024
    },
    "entry_module": {
      "$ref": "#/$defs/identifier"
    },
    "modules": {
      "type": "array",
      "minItems": 1,
      "maxItems": 1024,
      "items": {
        "$ref": "#/$defs/module"
      }
    },
    "assets": {
      "type": "array",
      "maxItems": 8192,
      "items": {
        "$ref": "#/$defs/asset"
      }
    },
    "requested_capabilities": {
      "type": "array",
      "maxItems": 256,
      "uniqueItems": true,
      "items": {
        "$ref": "#/$defs/contract_id"
      }
    },
    "tags": {
      "type": "array",
      "maxItems": 32,
      "uniqueItems": true,
      "items": {
        "type": "string",
        "minLength": 1,
        "maxLength": 32,
        "pattern": "^[a-z0-9]+(?:[._-][a-z0-9]+)*$"
      }
    }
  },
  "$defs": {
    "identifier": {
      "type": "string",
      "minLength": 1,
      "maxLength": 96,
      "pattern": "^[a-z][a-z0-9]*(?:[._-][a-z0-9]+)*$"
    },
    "contract_id": {
      "type": "string",
      "minLength": 3,
      "maxLength": 128,
      "pattern": "^[a-z][a-z0-9]*(?:[._-][a-z0-9]+)+$"
    },
    "semantic_version": {
      "type": "string",
      "maxLength": 64,
      "pattern": "^(0|[1-9][0-9]*)\\.(0|[1-9][0-9]*)\\.(0|[1-9][0-9]*)(?:-[0-9A-Za-z.-]+)?(?:\\+[0-9A-Za-z.-]+)?$"
    },
    "relative_path": {
      "type": "string",
      "minLength": 1,
      "maxLength": 240,
      "pattern": "^[A-Za-z0-9._-]+(?:/[A-Za-z0-9._-]+)*$"
    },
    "module": {
      "type": "object",
      "additionalProperties": false,
      "required": [
        "id",
        "kind",
        "path",
        "depends_on"
      ],
      "properties": {
        "id": {
          "$ref": "#/$defs/identifier"
        },
        "kind": {
          "$ref": "#/$defs/contract_id"
        },
        "path": {
          "$ref": "#/$defs/relative_path"
        },
        "depends_on": {
          "type": "array",
          "maxItems": 128,
          "uniqueItems": true,
          "items": {
            "$ref": "#/$defs/identifier"
          }
        }
      }
    },
    "asset": {
      "type": "object",
      "additionalProperties": false,
      "required": [
        "id",
        "path",
        "media_type"
      ],
      "properties": {
        "id": {
          "$ref": "#/$defs/identifier"
        },
        "path": {
          "$ref": "#/$defs/relative_path"
        },
        "media_type": {
          "type": "string",
          "minLength": 3,
          "maxLength": 128,
          "pattern": "^[a-z0-9][a-z0-9!#$&^_.+-]*/[a-z0-9][a-z0-9!#$&^_.+-]*$"
        }
      }
    }
  }
}
